{
    "title": "Mock: unsolved on start",
    "grid": {
        "rows": 2,
        "cols": 2
    },
    "pieces": [
        {
            "type": "source",
            "color": "red",
            "direction": "south",
            "strength": 3,
            "coords": {
                "row": 0,
                "col": 0
            }
        },
        {
            "type": "wall",
            "coords": {
                "row": 1,
                "col": 0
            }
        },
        {
            "type": "target",
            "color": "red",
            "coords": {
                "row": 1,
                "col": 1
            }
        }
    ],
    "inventory": []
}