{
    "title": "Red + Green = Yellow",
    "grid": {
        "rows": 4,
        "cols": 4
    },
    "pieces": [
        {
            "type": "source",
            "color": "red",
            "direction": "south",
            "strength": 6,
            "coords": {
                "row": 0,
                "col": 0
            }
        },
        {
            "type": "wall",
            "coords": {
                "row": 2,
                "col": 0
            }
        },
        {
            "type": "target",
            "color": "red",
            "coords": {
                "row": 2,
                "col": 2
            }
        }
    ],
    "inventory": [
        {
            "type": "mirror",
            "rot": "/",
            "count": 1
        },
        {
            "type": "source",
            "color": "green",
            "strength": 1,
            "direction": "north",
            "count": 2
        }
    ]
}